ThankYou!|Player House|||||22||
Spawn|Empty||0|0||||
Set|Camera||50|50||||
Dialogue|Empty|Thank you for playing The Echo of Laventia!||||||
Dialogue|Empty|Congratulations on completing the quest in time for princess Anneliesia's visit. Sembria is in your debt.||||||
Dialogue|Empty|That is all the story I have for now, I hope you enjoyed your time.||||||
Dialogue|Empty|Please fill out the form with any issues or suggestions you have.||||||
Dialogue|Empty|The game will continue in free play mode, thanks for playing!||||||